[
  {
    "id": "salernotoday-eventi-sicignano-degli-alburni-doppio-weekend-per-la-54-sagra-della",
    "nome": "Sicignano degli Alburni, doppio weekend per la 54ª Sagra della castagna",
    "link": "https://www.salernotoday.it/eventi/sagre/sagra-castagna-17-18-24-25-ottobre-2026.html",
    "data_inizio": "2026-10-17",
    "data_fine": "2026-10-25",
    "tipo": "evento",
    "curated": false,
    "source": {
      "name": "SalernoToday — sezione Eventi",
      "url": "https://www.salernotoday.it/eventi/",
      "type": "external",
      "id": "salernotoday-eventi"
    },
    "license": "da verificare (testata registrata, contenuti (c))",
    "retrieved_at": "2026-10-21T10:43:50+00:00",
    "provenance": "obscura fetch --stealth su https://www.salernotoday.it/eventi/",
    "visto_ultima_volta": "2026-10-21",
    "visto_prima_volta": "2026-10-21"
  },
  {
    "id": "salernotoday-eventi-cava-de-tirreni-il-trio-di-alessandro-carbonare-apre-i-conce",
    "nome": "Cava de' Tirreni, il trio di Alessandro Carbonare apre i \"Concerti d'autunno\"",
    "link": "https://www.salernotoday.it/eventi/concerti/concerto-alessandro-carbonare-cava.html",
    "data_inizio": "2026-10-21",
    "data_fine": "2026-11-19",
    "tipo": "evento",
    "curated": false,
    "source": {
      "name": "SalernoToday — sezione Eventi",
      "url": "https://www.salernotoday.it/eventi/",
      "type": "external",
      "id": "salernotoday-eventi"
    },
    "license": "da verificare (testata registrata, contenuti (c))",
    "retrieved_at": "2026-10-21T10:43:50+00:00",
    "provenance": "obscura fetch --stealth su https://www.salernotoday.it/eventi/",
    "visto_ultima_volta": "2026-10-21",
    "visto_prima_volta": "2026-10-11"
  },
  {
    "id": "salernotoday-eventi-salerno-al-teatro-arbostella-torna-la-rassegna-per-bambini",
    "nome": "Salerno, al Teatro Arbostella torna la rassegna per bambini",
    "link": "https://www.salernotoday.it/eventi/teatro/rassegna-bambini-salerno.html",
    "data_inizio": "2026-10-21",
    "data_fine": "2026-11-19",
    "tipo": "evento",
    "curated": false,
    "source": {
      "name": "SalernoToday — sezione Eventi",
      "url": "https://www.salernotoday.it/eventi/",
      "type": "external",
      "id": "salernotoday-eventi"
    },
    "license": "da verificare (testata registrata, contenuti (c))",
    "retrieved_at": "2026-10-21T10:43:50+00:00",
    "provenance": "obscura fetch --stealth su https://www.salernotoday.it/eventi/",
    "visto_ultima_volta": "2026-10-21",
    "visto_prima_volta": "2026-10-11"
  },
  {
    "id": "salernotoday-eventi-giovediamoci-2026-nella-sala-teatro-de-i-giardini-di-trotula",
    "nome": "Giovediamoci 2026, nella Sala Teatro de \"I Giardini di Trotula\" arriva Rossana Lamberti",
    "link": "https://www.salernotoday.it/eventi/cultura/giovediamoci-presentazione-libro-rossana-lamberti-22-ottobre-2026.html",
    "data_inizio": "2026-10-22",
    "data_fine": "2026-10-22",
    "tipo": "evento",
    "curated": false,
    "source": {
      "name": "SalernoToday — sezione Eventi",
      "url": "https://www.salernotoday.it/eventi/",
      "type": "external",
      "id": "salernotoday-eventi"
    },
    "license": "da verificare (testata registrata, contenuti (c))",
    "retrieved_at": "2026-10-21T10:44:14+00:00",
    "provenance": "obscura fetch --stealth su https://www.salernotoday.it/eventi/",
    "visto_ultima_volta": "2026-10-21",
    "visto_prima_volta": "2026-10-21"
  },
  {
    "id": "salernotoday-eventi-i-sapori-della-tradizione-torna-la-sagra-della-pastorella-cu",
    "nome": "I sapori della tradizione: torna la Sagra della Pastorella Cuccarese",
    "link": "https://www.salernotoday.it/eventi/sagre/sagra-pastorella-cuccarese-23-24-ottobre-2026.html",
    "data_inizio": "2026-10-23",
    "data_fine": "2026-10-24",
    "tipo": "evento",
    "curated": false,
    "source": {
      "name": "SalernoToday — sezione Eventi",
      "url": "https://www.salernotoday.it/eventi/",
      "type": "external",
      "id": "salernotoday-eventi"
    },
    "license": "da verificare (testata registrata, contenuti (c))",
    "retrieved_at": "2026-10-21T10:44:31+00:00",
    "provenance": "obscura fetch --stealth su https://www.salernotoday.it/eventi/",
    "visto_ultima_volta": "2026-10-21",
    "visto_prima_volta": "2026-10-21"
  },
  {
    "id": "salernotoday-eventi-ottobre-in-jazz-fabrizio-bosso-e-julian-oliver-mazzariello-a",
    "nome": "“Ottobre in Jazz “, Fabrizio Bosso e Julian Oliver Mazzariello a Il Moro di Cava de' Tirreni",
    "link": "https://www.salernotoday.it/eventi/concerti/bosso-mazzariello-moro-cava-23-ottobre-2026.html",
    "data_inizio": "2026-10-23",
    "data_fine": "2026-10-23",
    "tipo": "evento",
    "curated": false,
    "source": {
      "name": "SalernoToday — sezione Eventi",
      "url": "https://www.salernotoday.it/eventi/",
      "type": "external",
      "id": "salernotoday-eventi"
    },
    "license": "da verificare (testata registrata, contenuti (c))",
    "retrieved_at": "2026-10-21T10:44:31+00:00",
    "provenance": "obscura fetch --stealth su https://www.salernotoday.it/eventi/",
    "visto_ultima_volta": "2026-10-21",
    "visto_prima_volta": "2026-10-21"
  },
  {
    "id": "salernotoday-eventi-moio-della-civitella-a-pellare-torna-la-sagra-della-castagna",
    "nome": "Moio della Civitella, a Pellare torna la Sagra della Castagna",
    "link": "https://www.salernotoday.it/eventi/sagre/moio-della-civitella-a-pellare-torna-la-sagra-della-castagna.html",
    "data_inizio": "2026-10-24",
    "data_fine": "2026-10-24",
    "tipo": "evento",
    "curated": false,
    "source": {
      "name": "SalernoToday — sezione Eventi",
      "url": "https://www.salernotoday.it/eventi/",
      "type": "external",
      "id": "salernotoday-eventi"
    },
    "license": "da verificare (testata registrata, contenuti (c))",
    "retrieved_at": "2026-10-21T10:44:50+00:00",
    "provenance": "obscura fetch --stealth su https://www.salernotoday.it/eventi/",
    "visto_ultima_volta": "2026-10-21",
    "visto_prima_volta": "2026-10-21"
  },
  {
    "id": "salernotoday-eventi-come-il-vento-a-olevano-sul-tusciano-i-ventagli-d-arte-diven",
    "nome": "\"Come il vento\": a Olevano sul Tusciano i ventagli d’arte diventano un racconto sul clima",
    "link": "https://www.salernotoday.it/eventi/mostre/come-il-vento-mostra-olevano-tusciano.html",
    "data_inizio": "2026-10-25",
    "data_fine": "2026-11-14",
    "tipo": "evento",
    "curated": false,
    "source": {
      "name": "SalernoToday — sezione Eventi",
      "url": "https://www.salernotoday.it/eventi/",
      "type": "external",
      "id": "salernotoday-eventi"
    },
    "license": "da verificare (testata registrata, contenuti (c))",
    "retrieved_at": "2026-10-21T10:45:08+00:00",
    "provenance": "obscura fetch --stealth su https://www.salernotoday.it/eventi/",
    "visto_ultima_volta": "2026-10-21",
    "visto_prima_volta": "2026-10-21"
  },
  {
    "id": "salernotoday-eventi-pooh-60-la-nostra-storia-il-grande-ritorno-live-doppia-data-",
    "nome": "\"Pooh 60 – La nostra storia”, il grande ritorno live: doppia data al PalaSele",
    "link": "https://www.salernotoday.it/eventi/concerti/pooh-60-la-nostra-storia-live.html",
    "data_inizio": "2026-10-27",
    "data_fine": "2026-10-28",
    "tipo": "evento",
    "curated": false,
    "source": {
      "name": "SalernoToday — sezione Eventi",
      "url": "https://www.salernotoday.it/eventi/",
      "type": "external",
      "id": "salernotoday-eventi"
    },
    "license": "da verificare (testata registrata, contenuti (c))",
    "retrieved_at": "2026-10-21T10:45:46+00:00",
    "provenance": "obscura fetch --stealth su https://www.salernotoday.it/eventi/",
    "visto_ultima_volta": "2026-10-21",
    "visto_prima_volta": "2026-10-11"
  },
  {
    "id": "salernotoday-eventi-mattoni-europei-ilenia-zodiaco-alla-feltrinelli-appuntamento",
    "nome": "\"Mattoni europei\", Ilenia Zodiaco alla Feltrinelli: appuntamento il 28 ottobre",
    "link": "https://www.salernotoday.it/eventi/cultura/incontro-ilenia-zodiaco-feltrinelli.html",
    "data_inizio": "2026-10-28",
    "data_fine": "2026-10-28",
    "tipo": "evento",
    "curated": false,
    "source": {
      "name": "SalernoToday — sezione Eventi",
      "url": "https://www.salernotoday.it/eventi/",
      "type": "external",
      "id": "salernotoday-eventi"
    },
    "license": "da verificare (testata registrata, contenuti (c))",
    "retrieved_at": "2026-10-21T10:46:02+00:00",
    "provenance": "obscura fetch --stealth su https://www.salernotoday.it/eventi/",
    "visto_ultima_volta": "2026-10-21",
    "visto_prima_volta": "2026-10-21"
  },
  {
    "id": "salernotoday-eventi-cibo-musica-e-divertimento-a-montano-antilia-quattro-giorni-",
    "nome": "Cibo, musica e divertimento: a Montano Antilia quattro giorni con la \"Festa della Castagna\"",
    "link": "https://www.salernotoday.it/eventi/sagre/festa-della-castagna-montano-antilia-29-ottobre-1-novembre-2026.html",
    "data_inizio": "2026-11-01",
    "data_fine": "2026-11-01",
    "tipo": "evento",
    "curated": false,
    "source": {
      "name": "SalernoToday — sezione Eventi",
      "url": "https://www.salernotoday.it/eventi/",
      "type": "external",
      "id": "salernotoday-eventi"
    },
    "license": "da verificare (testata registrata, contenuti (c))",
    "retrieved_at": "2026-10-21T10:46:21+00:00",
    "provenance": "obscura fetch --stealth su https://www.salernotoday.it/eventi/",
    "visto_ultima_volta": "2026-10-21",
    "visto_prima_volta": "2026-10-21"
  },
  {
    "id": "salernotoday-eventi-festa-della-castagna-braciglianese-dal-6-all-8-novembre-la-p",
    "nome": "Festa della Castagna Braciglianese: dal 6 all'8 novembre la prima edizione",
    "link": "https://www.salernotoday.it/eventi/sagre/festa-castagna-bracigliano-6-7-8-novembre-2026.html",
    "data_inizio": "2026-11-06",
    "data_fine": "2026-11-08",
    "tipo": "evento",